,headlines
301,In tremendous danger: Bob Arum gives update on Boxing champions Lomachenko and Usyk amidst Russian Shelling in Ukraine
302,Anti-war protester who crashed Russian TV broadcast appears in Moscow court
303,"Russia stops athletes from competing in International Judo competitions, cites safety reasons"
304,Saudi Arabia reportedly considering accepting yuan instead of dollar for oil sales
305,"Had China known of Russia’s plan for Ukraine invasion ‘we would have tried our best to prevent it,’ ambassador to U.S. says"
306,Negotiations between the delegations of Ukraine and Russia will continue on Wednesday
307,Latest North Korea projectile launch ends in failure
308,Russian airlines face safety countdown to secure parts
309,Japan to revoke Russia's most-favored nation trade status
310,"S.Korea reports record 400,741 new daily COVID cases - KDCA"
311,"China continues to fight its worst Covid-19 outbreak, sees highest daily count since start of pandemic"
312,Ukraine: Italian aircraft very close to war zone
313,Ukraine claims to have arrested 'hacker' helping Russians
314,"Ukrainian government has asked Japan to allow its president, Volodymyr Zelenskyy, to address Diet via a video link. Ukrainian Embassy in Tokyo told Foreign Ministry it would make necessary arrangements with its own government if proposal proves acceptable."
315,Neo-Nazis are exploiting Russia’s war in Ukraine for their own purposes
316,"A Ukrainian and Russian pianist play a Mozart duet: ‘with music, you become connected’"
317,War in Ukraine: Cars exit Mariupol in first successful humanitarian corridor
318,Russian clients have up to CHF200 billion in Swiss banks
319,"U.S. embassy says Russian troops ""shot and killed 10 people standing in line for bread"" in northeast Ukraine"
320,Ukrainian director Vasyanovych turns to camera to document war
321,"Following Russia’s invasion of Ukraine, many research organizations swiftly cut funding and collaboration ties with Russia. But the moves have sparked debate over whether Russian scientists should be able to publish in international journals."
322,World Must Not Forget Afghanistan Because Of Ukraine War: UN
323,"Russia and Ukraine ‘close to agreeing’ on neutral status, says Sergei Lavrov."
324,Olympic medallist who fled Belarus forced into exile again as Ukraine attacked
325,"[World] - Russian forces retreat at Mariupol, Ukraine says | Washington Times"
326,Ukraine Found Dart-Like Mystery Warheads. They're Russia's New Weapon.
327,Female suicides rise in Japan for 2nd straight year in 2021
328,"Lukashenko says Belarus has been hit by a missile, but he is ''not going'' to go to war"
329,Zelenskyy Says Ukraine 'Must Admit' It Won't Join NATO
330,One hundred Ukraine banners to fly along route of St Patrick’s Day parade in Dublin
331,Portugal not able to ban Abramovich from entering country
332,"Ukraine now developing nuclear arms with US help, claims Russia"
333,Northvolt to build its third battery gigaplant in northern Germany
334,"Belarus resisting attempts to drag it into Ukraine conflict, Lukashenko says | Reuters"
335,India's top refiner IOC buys 3 mln bbls Russian Urals crude via tender
336,"Yemen hunger crisis: $4.3bn needed, says UN"
337,Ethiopian forces burned Tigrayan man alive — EHRC
338,Three EU leaders to visit Kyiv to show Ukraine support
339,Russians set to launch new 'Rossgram' photo-sharing app after Instagram blocked by the Kremlin
340,U of A to waive tuition costs for Ukrainian international students affected by Russian invasion
341,Russians' demand for VPNs skyrockets after Meta block
342,These Putin Pals Were Mysteriously Spared From U.S. Sanctions
343,Pakistan to send aid to Ukraine.
344,Baker McKenzie to spin-off 260-strong Russian offices
345,Magnitude 4.7 earthquake hits southeastern Taiwan
346,Russia’s ruble continues its slide as new curbs restrict access to foreign currency.
347,"Leaders of Poland, Czech Republic, Slovenia to visit Kyiv on Tuesday. Set to travel by train."
348,"/r/WorldNews Live Thread: Russian Invasion of Ukraine Day 20, Part 3 (Thread #146)"
349,"Prime Ministers of the Czech Republic, Poland and Slovenia as well as Deputy Prime Minister of Poland will travel to Kyiv on Tuesday to meet with Zelensky"
350,Ukraine war: West made 'terrible mistake' over Putin - PM
351,US issues new sanctions on Belarusian President Lukashenko
352,Russia bans 2 Israeli news sites
353,Putin warns Russia against pro-Western 'traitors' and scum
354,Biden to visit Europe next week to discuss Russian invasion of Ukraine with European leaders
355,Japanese woman living in Poland becomes a 'bridge' for supplies to Ukraine
356,NASA confirms U.S. astronaut will return with cosmonauts on Russian spacecraft later this month
357,"Trapped in Mariupol: ‘They shoot hard, we sit in the basement’"
358,"Russia steps up bombardment of Kyiv, civilians flee Mariupol"
359,China Says It Wants to Avoid U.S. Sanctions Over Russia’s War
360,World court to rule on emergency measures in Ukraine vs Russia
361,US astronaut's return from space station on Russian Soyuz still on track - NASA
362,"Pakistan is sending aid to Ukraine, includes emergency medicines, electro-medical equipment, winter bedding & food items. 2 C130 flights of PAF are being sent to deliver more than 15 tons of aid for Ukrainian refugees. The relief was handed over to Ukrainian Embassy by FM Qureshi and Chairman NDMA"
363,"Boris Johnson going ‘from dictator to dictator’ for oil, says Starmer"
364,Canada’s defence chief warns Russia has reoccupied Arctic bases - National | Globalnews.ca
365,"Putin says Russia will achieve goals in Ukraine, won't bow to West."
366,"Zelensky won't address Council of Europe due to 'urgent, unforeseen circumstances'"
367,China admits COVID-19 situation ‘grim and complex’
368,Ukraine Crisis: China wants to avoid US sanctions over Russia's war
369,"E.U. presents plan to cut Russian gas imports by two-thirds this year, stops short of boycott"
370,Indian Missile Accident Nearly Led to Pak Retaliation: Report
371,Experts warn that Canadian weapons shipped to Ukraine could end up in the wrong hands | CBC News
372,‘Turning point’: War in Ukraine tests shaky US-China relations
373,"UK supplying starstreak anti-aircraft missiles to Ukraine, defence minister Wallace tells BBC"
374,Oleksandr Shpunt a Kremlin Political Strategist says that the Russians will not occupy Ukraine after the war
375,U.S. Senate unanimously condemns Putin as war criminal
376,"We propose to impose sanctions against all Russian officials who remain in office - Zelensky, speaking at U.S. congress"
377,Saudi Arabia: Boris Johnson to raise human rights in energy talks
378,China stands with Iran on nuclear deal after talks paused amid Russia’s conflict with West
379,Hundreds of Canadians offer homes to Ukrainian refugees via Airbnb
380,"Tigray war has seen up to half a million dead from violence and starvation, say researchers"
381,Johan Hegg calls for ban of Russian fighters from UFC events
382,Senegal begins military operation against Casamance secessionists
383,30% of Russian Oil Output May Disappear in a Few Weeks
384,Zelensky proposes to create new intl association of states U24 – United for Peace
385,Stranding of three whales in Corfu raises alarm over seismic testing for fossil fuels
386,Hope for trapped civilians as first convoy escapes besieged Mariupol after 10 days of failed attempts
387,"Russia, Ukraine talk of ‘compromise’ as peace talks set to resume"
388,Ukrainian children with cancer to be flown to Toronto hospital for treatment
389,"EU Parliament adopts new draft legislation, dictating manufacturers of smartphones that batteries must be designed so that consumers and independent operators can easily and safely remove them themselves by 2024"
390,"Zelensky: already adopted sanctions not enough, embargo on any trade with Russia needed"
391,Israeli court to rule on displacement of West Bank Palestinians
392,World Court orders Russia to cease military operations in Ukraine
393,"U.N. court orders Russia to halt its invasion of Ukraine, in a largely symbolic ruling"
394,'Europe stands with you': EU leaders express solidarity with Ukraine after Zelensky meeting
395,Top Russian Officials Meet With Central Asian Leaders As West Imposes Sanctions
396,China: call to protect pets from slaughter during coronavirus lockdowns after string of horrific incidents saw cats and dogs killed
397,Medvedev Wimbledon hopes could hinge on political assurance - UK minister
398,World Court to rule in Ukraine case against Russia on March 16
399,"EU 'Concerned' Over Disrupted Gas Supply, Shootings In Nagorno-Karabakh:"
400,"Russian forces have been pushed back slightly from Ukraine's Mykolayiv city, says governor"
401,US holds ‘intense’ 7-hour talks with China amid Russia’s war in Ukraine
402,Kremlin says demilitarised Ukraine like Austria is possible compromise
403,NATO trains for anti-submarine warfare amid Russian attack on Ukraine
404,N.Korea courts disaster with missile tests from international airport
405,World Bank approves $200 million in additional funding for Ukraine
406,Ukraine President Zelenskyy thanks woman who interrupted Russian TV news with anti-war sign
407,NT ICAC considering inquiry into Constable Zachary Rolfe's arrest over fatal shooting of Kumanjayi Walker
408,"War could be over by May, says Ukrainian presidential adviser"
409,Canada and US announce Arctic military exercises amid Russia tensions
410,Prosecutors Demand Extra 13-Year Prison Sentence for Alexei Navalny
411,Russian troops take patients and staff hostage at Ukrainian hospital
412,Afghanistan: India sends fourth shipment of wheat to Afghanistan via Pakistan
413,"Ukrainian spiritual and diplomatic leaders urge aid, weapons"
414,What Russia's looming debt default means for global economy
415,Pfizer Will Donate All Russian Profits To Ukrainian Relief Efforts
416,Banks on alert for Russian reprisal cyber attacks on Swift
417,"India boosts fertiliser imports from Canada, Israel as Russian supply disrupted"
418,Ukraine’s capital under fire; 3 EU nation leaders to visit
419,"On Taiwanese island, drills underscore strategic importance and vulnerability"
420,"Russia, India explore opening alternative payment channels amid sanctions"
421,Germany to buy F-35s to replace aging bombers
422,Apple to start producing iPhone 13 in India's Foxconn plant starting April
423,Ukraine says it launches counteroffensives against Russian forces
424,"Russian bombardment of Kyiv kills four, curfew called"
425,Another Evergreen shipping vessel runs aground
426,"Britain to ban exports of luxury goods to Russia, impose new import tariffs"
427,No indication India's missile launch into Pakistan was anything other than accident: US
428,"Belarusian armed forces are pushing asylum seekers from the Middle East who became trapped in the country after they were promised passage to the EU to cross the border into war-torn Ukraine, according to the testimony of people in Belarusian camps"
429,Russia may have found a buyer for its cheap oil: India
430,"Officials, execs see US firms switching to Turkey amid Ukraine war"
431,Ukrainian president Zelenskyy approaches Japan over possible online speech to parliament; Japanese parliament building lacks the necessary technology
432,Slovakia charges two people with espionage for Russia
433,"Bennett holds back-to-back phone calls with Putin, Zelensky on ceasefire efforts"
434,"Oil drops again, now more than 25% below recent high"
435,"Russia says it's sanctioning Biden, Hillary Clinton and other top U.S. officials"
436,Russia Deploys a Mystery Munition in Ukraine
437,There are so many Canadians joining Ukraine in the fight that they have their own batallion...
438,"/r/WorldNews Live Thread: Russian Invasion of Ukraine Day 21, Part 2 (Thread #148)"
439,Abramovich flies into Moscow as yachts are seized and caviar banned in hit to Russia's rich
440,Ukraine accuses Russia of abducting mayor of southern Ukrainian city
441,"Citing a Chevron Tanker, Ukraine Seeks Tougher Restrictions at Russian Ports"
442,"Refugee website crashes as 89,000 Britons rush to take in Ukrainians"
443,Ukraine official says Russian troops have taken 500 hostage at Mariupol hospital
444,"Japan to revoke Russia's most-favoured nation trade status, NHK says"
445,"/r/WorldNews Live Thread: Russian Invasion of Ukraine Day 19, Part 1 (Thread #142)"
446,Mayor of Ukraine's Kharkiv says Russian forces firing at city non-stop
447,"Poland has seen indications that human traffickers may be targeting refugees fleeing the Ukraine war, officials and aid workers said on Tuesday, and although trafficking cases have not been confirmed, preventative efforts are now being put in place."
448,Russian tanks in Ukraine are sprouting cages
449,North Korean missile launch apparently ends in failure
450,Russian Pianist Calls for Power to Be Cut to Kyiv
451,Former Ukrainian president wearing camouflage vest tells reporter he and his fighters are 'not waiting for the NATO troops'
452,Pope Francis to Consecrate Ukraine and Russia to Immaculate Heart of Mary
453,Germany advises citizens to uninstall Kaspersky antivirus
454,"Russia State-TV Protester Gets Small Fine, But May Face More Legal Trouble"
455,"'Please, close the sky': says Ukraine President Zelensky in address to Canada's Parliament"
456,Nordic countries wonder if they are next on Putin's list
457,"Over 40,000 Syrians reportedly register to fight for Russia in Ukraine"
458,Russian Navy Landing Ships Seen Approaching Ukrainian Coast Near Odessa - Naval News
459,UK says it has settled historic debt to Iran | Reuters
460,Retirement fight of Fedor Emelianenko moved from Russia due to on-going war
461,Trudeau and almost every Canadian MP banned from Russia
462,International Criminal Court to issue ruling on allegations of genocide against Russia on Wednesday
463,Canada's inflation rate now at 30-year high of 5.7%
464,Dutch Covid denier Willem Engel arrested for sedition
465,Boris Johnson vows to end ‘addiction’ to Russian fuel ahead of Saudi Arabia trip
466,Spain seizes Russian oligarch's $140 million dollar yacht in Barcelona
467,Will there be a Ukraine peace deal? Kremlin says not giving predictions
468,"7.3 magnitude quake hits North Japan, tsunami alert issued"
469,"Marina Ovsyannikova, who sensationally interrupted Russia's Channel One news broadcast with a protest sign, is currently awaiting trial in the Ostankinsky district court of Moscow on presumably administrative charges"
470,"China says it’s ‘impartial’ on Ukraine, denies aiding Russia"
471,Canada prohibits Belarusian aircraft from entering its airspace
472,Russia says quitting Council of Europe - Digital Journal
473,Kremlin calls anti-war protest on state TV 'hooliganism' | Reuters
474,Ukraine detains hacker who allegedly aided Russian military
475,"Russia is nearly isolated online. What does that mean for the internet’s future? Concerns about the emergence of a “splinternet,” or a balkanization of the web, have been gaining momentum. The war in Ukraine threatens to make them a reality."
476,"Putin says Russia will achieve goals in Ukraine, won&#x27;t bow to West"
477,"Pfizer will donate profits from Russia to ""humanitarian support"""
478,"China's COVID curbs hit Toyota, Volkswagen and Apple supplier Foxconn"
479,"For Syrian survivors, Russia’s tactics in Ukraine eerily similar"
480,German official: Ukraine war will boost low-emissions tech
481,"Russian forces on Wednesday targeted the southern Ukraine city of Zaporizhzhia, where thousands of refugees are taking shelter after escaping the besieged port city of Mariupol, regional officials said. “Civilian objects have been bombed for the first time in Zaporizhzhia”"
482,"Help yourself by helping us, Ukraine's Zelenskiy tells northern European leaders"
483,Russia's prime minister threatens retaliation against countries that ban Russian ships from ports
484,Mass graves in Ukraine: Battered cities are being forced to dig makeshift burial sites for victims of Russian shelling
485,ICJ orders Russia to suspend invasion of Ukraine
486,Ukraine war: Protester exposes cracks in Kremlin's war message
487,Biden will travel to Brussels this month for NATO summit about Russia's attack on Ukraine
488,United Nations estimates number of refugees in 3 million
489,"Russian oil output is about to fall 30%. A supply shock is coming, IEA warns"
490,Ukrainian Parliament extends martial law for 30 days
491,French companies must implement sanctions against Russia - govt spokesman
492,The Armed Forces of Ukraine repulsed the attack of the Russian occupation army near Kharkiv and pushed the enemy out of its previous positions
493,Close to 3 million have fled fighting in Ukraine
494,"North Korea fires 'unidentified projectile' but launch fails, says South"
495,"Major mining firms operating in Brazil joined a chorus of criticism Tuesday of President Jair Bolsonaro's push to legalize mining on indigenous reservations, including in the Amazon rainforest"
496,Russia seeks 13-year jail term for Kremlin critic Alexei Navalny
497,UK imposes sanctions on Russian products and bans some exports | Foreign policy
498,These U.S. companies continue to do business in Russia
499,European Parliament declares Mexico as the most dangerous and deadly country for journalists
500,U.S. reveals charges against Russian businessman in campaign finance case
501,Pierre Zakrzewski: Tributes paid to Irish journalist killed after vehicle hit by Russian fire outside Kyiv - Independent.ie
502,The PACE in Strasbourg to Officially Recognize Transnistria as a Zone of Russian Occupation
503,Czech leader after Kyiv visit: Ukraine above all needs more weapons
504,"Pope to Consecrate Russia, Ukraine to Mary"
505,A BBC investigation has uncovered new evidence about the corrupt deals that made Roman Abramovich's fortune.
506,Hundreds protest in crisis-hit Sri Lanka as IMF talks loom
507,"Trudeau, Joly, Anand banned from Russia"
508,New Zealand halves public transport fares as petrol prices soar amid Russia-Ukraine war
509,Volodymyr Zelensky says Ukraine won't join NATO
510,Reports of Russian drone landing in Romania - media
511,"India taking up Russian discounted oil offer will not be US sanctions violation, says White House"
512,Russia has unleashed its cruise missile arsenal on Ukraine
513,Canada lifting pre-arrival COVID-19 testing requirement as of April 1
514,"The most difficult situation is in the Mariupol area, where the Russians are trying to blockade the city on the western and eastern outskirts on the 20th day of the Russian invasion"
515,Russian advances remain stalled as Ukraine targets supply efforts
516,Ukraine's capital under fire; 3 EU nation leaders to visit
517,Russia's attack at Poland's border shattered the image of calm in western Ukraine
518,Union of European Football Associations ban of Russian teams upheld by Court of Arbitration for Sport
519,Marina Ovsyannikova: Russian journalist who protested Ukraine war on state TV news broadcast appears in court
520,Turkish drones are transforming the war in Ukraine
521,Submarine Spy Couple Tried to Sell Nuclear Secrets to Brazil
522,No indication firing of missile from India into Pakistan anything other than accident: US
523,Sri Lankan protesters demand president quit over economic crisis
524,Berlin warns Ukrainian refugees about trafficking danger
525,Priority Pass suspends Russia operations
526,Museveni’s army general son meets Kagame to fix Rwanda relations
527,Russian navy convoy passes through strait off Japan
528,"A year after the Ever Given got stuck in the Suez Canal, another massive ship, the Ever Forward, has run aground in Chesapeake Bay"
529,"Leaders of Poland, Czech Republic, Slovenia to visit Kyiv on Tuesday"
530,Fears Russia will not be able to pay its debts mount
531,Facebook fined €17m by Data Protection Commission
532,Kazakhstan president proposes reforms to limit his powers
533,Russian missile strike near NATO's Poland stirs anxiety
534,"Indian court upholds Karnataka state's ban on hijab in class, could set a precedent for the rest of the country which has a big Muslim minority."
535,Three men questioned after breaking into villa owned by Putin's son-in-law in south of France
536,France ready to discuss ‘autonomy’ for Corsica: Interior minister
537,Slovakia expels three Russian diplomats due to suspicion of espionage
538,India acts to seize gap in wheat export market left by Ukraine war
539,"Russian forces dropped a massive bomb on the Mariupol Drama Theater, where hundreds of civilians are hiding from war"
540,Slovakia expels three Russian embassy staff; report of arrests for espionage
541,"Russian Oligarch Roman Abramovich Invested At Least $1.3 Billion With US Financiers, Secret Records Show"
542,India in talks to buy discounted Russian oil
543,Kim Jong Un visits mega skyscraper project in Pyongyang ahead of April opening
544,Putin signs law to allow online voting at elections across Russia
545,Serbian Airbus A-319 airliner on its way from Belgrade to Moscow intercepted by Hungarian Gripen fighter jets and escorted outside Hungary’s airspace after air traffic control was told the plane was carrying a bomb
546,China orders 51 million into lockdown amid worst COVID outbreak since early 2020
547,Russian Journalist Interrogated for 14 Hours After Anti-War Protest
548,Putin's invasion was a 'terrible mistake': Russian prisoners of war voice shame about conflict
549,"Russia to spend $9 billion to rebuild supply chains, prime minister says"
550,"More than 100,000 Britons sign up to host a Ukrainian refugee | Evening Standard"
551,"New COVID-19 variants are coming soon, expert says"
552,"OSCE Chairman: Russian tactics ""amount to state terrorism."""
553,Singapore court rejects appeals by three men on death row despite United Nations criticism
554,Coronavirus Rates Jump At Some Wastewater Testing Sites—Even As Case Counts Decline
555,Refugee exodus reaches 2.8 million as Russia strikes hit west Ukraine
556,EU and UK hit Russia with wider sanctions that target luxury
557,Putin and Shoigu want to cut down and sell Ukrainian forests - Intelligence report
558,EU has no evidence of Russia's request to China for help in war with Ukraine
559,A charismatic governor leads the defence of a strategic Ukrainian port
560,Slovakia meets NATO defence spending commitment for first time
561,Russia formally quits Council of Europe rights watchdog
562,Kyiv Mayor Vitali Klitschko Responds To Putin Claim With A Single Blunt Word
563,Roman Abramovich's superyacht Solaris heads for Turkey as oligarch Chelsea owner gets assets out of Europe - crime catches up
564,"Kyiv mayor Vitali Klitschko, with Russian Forces nearing: “We’re Ready to Fight”"
565,"Russia is seizing Western-built airliners while sanctions block parts, maintenance, and support"
566,"Ukraine says it launches counteroffensives against Russian forces - Reuters, 16/03/2022"
567,Turkmenistan: Autocrat president's son claims landslide win
568,Chinese military releases video it says shows ADF plane flying in 'nuisance' manner during laser encounter
569,"The number of women committing suicide in Japan rose for the second straight year in 2021, totaling 7,068, due possibly to the lingering impact of the coronavirus pandemic, government data showed Tuesday."
570,China says it will 'never attack Ukraine' amid reports that Russia asked for military support
571,Russia sanctions: How the measures have changed daily life
572,Germany to buy 35 Lockheed F-35 fighter jets from U.S. amid Ukraine crisis
573,"UK refugee scheme could lead to exploitation of Ukrainians, say experts"
574,Top Russian TV journalist quits and flees country in protest over Ukraine war
575,UK moves to cut links with Russian science projects
576,Looting and attacks on aid workers rise as hunger adds to unrest in South Sudan
577,Flows through Russia's Yamal-Europe gas pipeline turn eastwards
578,"Refugee website crashes as 89,000 Britons rush to take in Ukrainians | Ukraine"
579,"Polish, Czech and Slovenian PMs visit Kyiv in EU show of support | News"
580,Russia temporarily bans grain exports to ex-Soviet countries
581,"‘Enemy’ the same: Thousands of protesters in war-torn Syria's rebel enclave of Idlib on Tuesday marked 11 years since the start of an anti-government uprising, buoyed by the global outcry over Russia's invasion of Ukraine"
582,"/r/WorldNews Live Thread: Russian Invasion of Ukraine Day 19, Part 2 (Thread #143)"
583,"A United Nations humanitarian agency says that since Russia invaded Ukraine, more than 1.5 million children have been forced to flee their homes, with about 55 kids becoming refugees every minute."
584,China’s Goal With Putin Is to Resist U.S. Without Economic Pain
585,"My life will always be devoted to service, UK's Queen Elizabeth says"
586,Chernobyl Staff Blasting Ukrainian Anthem to Defy Russian Captors: WSJ
587,Blinken: 'Irreversible’ withdrawal necessary to lift sanctions on Russia
588,Russia arrests multiple people for holding up blank signs: Anti-war protesters in Russia are being detained by police for holding up blank posters as part of demonstrations protesting against President Vladimir Putin's invasion of Ukraine.
589,Kremlin says neutral Ukraine like Austria is possible compromise
590,Sanctions-savaged Russia teeters on brink of historic default
591,"Foxconn, supplier of Apple and Dell parts, halts operations in Shenzhen as China locks down tech hub"
592,"NATO nations to meet in Brussels on March 24 to ""address Russia’s invasion of Ukraine"", says Stoltenberg"
593,"Czech, Polish, Slovenian PMs to visit Kyiv"
594,Warsaw Seeks NATO 'Peace Mission' To Help Ukraine
595,Several Russian POWs say they want to remain in Ukraine
596,British-Iranian Woman Detained In Iran Since 2016 Gets U.K. Passport Back
597,"Planes and smartwatches near Finland's Russian border had GPS issues, and not for the first time"
