,headlines
598,Civilian people are dying: Vitali Klitschko rubbishes claims from Russia
599,Indian Oil Corporation Buys Russian Crude At A Discount of $20-$25
600,Zelenskyy approaches Japan over possible online speech to parliament
601,Le Pen gets ahead of far-right rival amid soaring energy prices
602,Zelensky pressed Biden for harsher economic penalties on Russia in latest call: reports
603,Two British-Iranians Said To Be Leaving Tehran After Years In Prison
604,The Kremlin has instructed regional authorities to hold rallies in support of the Russian army and Putin
605,Ukrainian Special Forces Have Plans for an Insurgency Against Russia
606,Biden admin mulls providing Ukraine with Switchblade drones
607,Lithuanian FM becomes first foreign minister to visit Kyiv since the beginning of the invasion
608,Ever stuck: Suez container ship’s cousin runs aground in US harbor | Maryland | The Guardian
609,Russia’s richest man may have avoided freeze on £1bn Tui shares
610,"World War III 'may have already started' with Russian invasion, Zelenskyy says"
611,Austria says it wants to add more Russian oligarchs to EU sanctions list
612,"France ready to discuss autonomy for Corsica, France's interior minister says"
613,"TheJournal.ie - 'Hundreds' will die within days if aid does not reach Mariupol, deputy mayor says"
614,"Russian Forces Have Abducted a Second Ukrainian Mayor, Foreign Affairs Minister Says"
615,BBC News: How to spot false posts from Ukraine
616,Russia Fires Official Who Said China Refused to Supply Aircraft Parts
617,"As of 14:00, about 2,000 cars have been able to leave the besieged Ukrainian city of Mariupol and a further 2,000 are waiting to leave, city council says"
618,New Zealand cuts fuel tax and halves public transport fares for three months in response to petrol crisis
619,Russia's Lavrov says some deals with Ukraine close to being agreed
620,Ukrainian journalist killed in attack near Kyiv
621,Sri Lanka angry crowd tries to storm president’s office over economic woes
622,EU backs plan to impose carbon emissions tariff on imports
623,Parliament of NATO country Estonia calls for immediate establishment of no-fly zone
624,Shares in China fall amid strongest COVID-19 lockdown yet
625,Panic buying spreads in Middle East as Russian invasion sparks fear over food and fuel
626,"Russia's reliance on 'humanitarian corridors' in Ukraine comes from its playbook in Syria, experts say"
627,"Anonymous hackers hit Russian oil giant Rosneft, secure 20TB of data"
628,Biden signs spending bill that includes $13.6 billion in Ukraine aid
629,Marina Ovsyannikova: Russian journalist in court after TV protest
630,Panic Selling Grips Chinese Stocks in Biggest Plunge Since 2008
631,Occupiers take Mariupol hospital hostage - regional head
632,"Indigenous leaders from nine countries in the Amazon basin met in Ecuador on Tuesday and demanded South America governments halt extractive industries which damage the rainforest, urging them to respect agreements and legal rulings recognizing communities' rights over territories."
633,Russia fires official who said China refused to supply aircraft parts | Reuters
634,"7.3 magnitude earthquake shakes Japanese coast east of Fukushima, triggering tsunami warning."
635,Japan's COVID quasi-emergency to completely end: PM Kishida
636,"Orthodox churches, clergy and congregants inside Russia and abroad are breaking with the Russian Orthodox Church and its patriarch over the war in Ukraine and the ideology of the “Russian world” that underpins it."
637,I’m a reporter and producer working in Moscow for Al Jazeera where press freedoms have been limited. Ask me anything.
638,"/r/WorldNews Live Thread: Russian Invasion of Ukraine Day 21, Part 1 (Thread #147)"
639,A high court in India’s Karnataka state has ruled that the hijab is not “essential” to Islam - BBC News
640,Journalist who protested Ukraine war on Russian state TV is fined $280
641,"Ukraine-Russia talks have restarted, Ukrainian negotiator says"
642,Ukraine invasion opens political rift between cybercriminals
643,Ukrainian Railways launches nationalization of Russian rolling stock in Ukraine
644,Russian Drones Keep Breaching NATO Airspace
645,Shmyhal says $565B needed to rebuild war-torn Ukraine
646,Russian Oligarch Abramovich blocked from keeping his private jet in Israel
647,UEFA ban on Russian football teams upheld at CAS
648,Japan to allow evacuees from Ukraine to work
649,Russia's invasion drives NATO rethink of Europe force stance
650,"Singapore’s top diplomat said he hopes China will use its “enormous influence” on Russia to help end its war with Ukraine, warning that Beijing’s decisions in the coming days and weeks could determine the future path of the global economy."
651,"Hitachi donates $3 mln to Ukraine, GlobalLogic launches donation platform, pays commission"
652,Russia steps up assaults as Ukraine appeals for more help
653,Ukraine war: Russia’s ex-president among 370 new UK sanctions targets
654,Russian default looms as deadline for dollar bond payments arrives
655,European Sambo Championships moved to Serbia from Russia due to Ukraine conflict
656,"UK looking at ways to pay historic Iranian debt, foreign secretary says"
657,Turkey and Armenia have agreed to move forward with efforts to establish diplomatic relations “without conditions” and continue normalization efforts that could lead to the reopening of their shared borders for trade
658,Medics and volunteers try to prop up Ukraine's health system
659,Ukraine war sparks Europe rush to buy survival gear and food | Reuters
660,Ukraine's 'hero' President Zelensky set to receive honorary knighthood from UK
661,Russia's Lavrov says neutrality for Ukraine being seriously discussed
662,Banks on alert for Russian reprisal cyberattacks on Swift
663,Biden signs government funding bill that includes $13.6 billion in Ukraine aid
664,Bulgarian President: The Security System in Europe is Collapsing before our Eyes
665,UK's Boris Johnson says there's 'no way' Ukraine will join NATO 'anytime soon'
666,"Russia, Ukraine war: Government offers two-year visa to shelter 4000 family members of Ukrainians in New Zealand"
667,Powerful quakes rock northeastern Japan; tsunami warning issued
668,Chornobyl workers held 'hostage' amid fears for reactor safety - KyivPost - Ukraine's Global Voice
669,Ukraine war: Zelensky urges Russian troops to surrender
670,War crimes in Ukraine: Drone video captures killing of civilian
671,Queen Elizabeth II Joins Cultural Boycott of Russian State
672,"Invaders take hostage doctors, patients of intensive care hospital in Mariupol"
673,CITES Approves Totoaba Trade in Major Blow to Imperiled Vaquita Porpoise
674,"Britain to ask Saudi Arabia to condemn Russia over Ukraine, PM's spokesman"
675,Japan to revoke Russia's most-favoured nation trade status - PM Kishida
676,European leaders going to Ukraine’s embattled capital
677,Ural Trucks With Bodies Of Russian Soldiers Arrive In Belarus; Doctors Forced To Sign NDA
678,Nazanin Zaghari-Ratcliffe on way home to UK
679,Ukraine’s foreign legion joins the battle against Russia | Russia-Ukraine war News
680,"Ukraine Should Remain Stable, Independent, and Territorially Integral State, Says Kazakh Foreign Minister"
681,"A strong pressure anomaly event is driving warm temperatures into the Polar Circle, with peak temperatures in the Arctic reaching over 30 degrees warmer than normal"
682,EU bans top credit rating agencies rating Russia and Russian firms
683,Ancient sarcophagus found under Notre Dame cathedral in Paris
684,North Korea fires what could be a missile - NHK citing defmin source
685,"Russia imposes sanctions on Biden and Secretaries Blinken, Austin"
686,NATO defense chiefs hold special session on Ukraine
687,"Russia Deploys a Mystery Munition in Ukraine - Iskander-M short-range ballistic missiles are releasing a previously unknown decoy designed to evade air-defense systems, an American official said."
688,International Court of Justice orders Russia to cease military operations in Ukraine
689,Zelenskyy asked USA for air defence as an alternative to closing the sky
690,War deepens suffering for Ukraine’s drug users
691,Russian hackers broadcast fake ''Zelensky surrender'' statement on live Ukrainian TV
692,Swiss slap more sanctions on Russians in line with EU
693,Macron says he will continue talks with Putin despite not being ‘satisfied’ yet with results
694,Russian journalist Marina Ovsyannikova who staged on-air protest fears for her safety - but won't flee country
695,"In Mariupol, Russian troops take hostage doctors, patients of hospital"
696,British publishers censor books for western readers to appease China
697,Lukashenko dodges and weaves over joining Russia in attacking Ukraine
698,Why oil has suddenly dipped back down below $100
699,Russian oligarch Oleg Deripaska claims he does not own mansion occupied by squatters
700,Governmental report highlights Egypt’s efforts to incorporate green economy into western desert
701,Russia's finance minister has admitted the country can't use nearly half its $640 billion foreign currency war chest because of Western sanctions
702,"Russian troops have attacked Dnipro airport with widespread destruction - says Valentyn Reznichenko, head of the Dnipropetrovsk Regional State Administration"
703,Covid cases are rising as omicron's 'stealth' subvariant spreads around the world
704,Japanese Prime Minister expresses willingness for UN reform
705,Putin losing against Ukraine “Russian soldiers were evidently carrying dress uniforms for their victory parade in Kyiv rather than extra ammo and rations”
706,Blinken says there will be an independent Ukraine 'a lot longer than there's going to be a Vladimir Putin'
707,Irish watchdog fines Meta 17 million euros for data breach
708,Russian-owned auction house faces boycott by art world figures
709,Woman fearing for family in Ukraine urges Canada to waive visa for those fleeing war
710,"Tigray war has seen up to half a million dead from violence and starvation, say researchers - The Globe and Mail"
711,"Ukraine war: Joe Biden, Hillary Clinton and senior White House officials banned from entering Russia | US News"
712,"Japan imposes sanctions on 17 more Russians, including billionaire"
713,"India considers buying discounted Russian oil, commodities, officials say"
714,Ukraine detains 'hacker' accused of aiding Russian troops amid broader struggle to secure communications
715,Russia scrambles to prevent defaulting on debt payments as sanctions bite
716,"Japan to ban exports of nearly 300 items to Russia, Belarus"
717,"S.Korea reports record 400,741 new daily COVID cases"
718,"S. Korea's new COVID-19 cases surpass somber 400,000 milestone amid omicron wave"
719,"Ukraine accuses Russia of firing rockets at convoy of Mariupol evacuees, wounding child"
720,"In Change of Strategy, Russian Space Program Begs NASA for Help"
721,"Myanmar army engaged in torture, mass killings, war crimes - U.N."
722,"Russian ruling party ‘United Russia’ (""Yedinaya Rossiya’- ed.) is drafting a bill that criminalizes compliance with Western sanctions for business entities"
723,"Ukraine president says positions of Ukraine, Russia at talks sound more realistic"
724,Saudi Arabia considers accepting yuan instead of dollars for Chinese oil sales
725,There is no life for Ukrainian people: Boxing champion Wladimir Klitschko sharing harrowing footage from Ukraine
726,UN court to rule on bid for order to Russia to halt invasion
727,Number of women committing suicide rises in Japan for 2nd straight year
728,Boris Johnson arrives in UAE in bid to end West's 'addiction' to Vladimir Putin's oil and gas
729,"China has already decided to send economic aid to Russia in Ukraine conflict, US officials fear | China"
730,"China Locks Down Shenzhen, Province of 24 Million Over rising Covid cases"
731,Russian oligarch says he's 'appalled' by British police as squatters occupy London mansion for nearly 20 hours
732,Birth rate in Italy hit record low in 2021
733,China says Taiwan 'taking advantage' of Ukraine as island sends more aid
734,Australia and the Netherlands initiate legal proceedings against Russia over downed MH17 flight
735,Facebook parent company hit by €17 million fine by Irish regulator
736,At least one Canadian injured in Russian attack on Ukrainian military base used to train foreign fighters
737,Abramovich jet lands in Moscow after brief stop in Istanbul | Reuters
738,"Nazanin Zaghari-Ratcliffe has had UK passport returned, says MP"
739,Denmark proposes ban on selling cigarettes to people born after 2010
740,"EU approves new round of Russia sanctions targeting energy, steel, defence sectors"
741,"US bans import of all China’s Li-Ning products, citing use of North Korean labour. Li-Ning goods will not be allowed into the US ‘unless the importer provides clear and convincing evidence’ that no forced labour was involved in its manufacture."
742,‘I’m on the frontline in Mariupol’: the Chinese reporter embedded with Russian troops
743,"The Russian central bank won’t be reopening stock market trading on the Moscow Exchange between March 14-18, Reuters reported Saturday (March 12)."
744,"Fight for Ukraine's strategic port Mariupol continues, Chechen fighters join Russia's offensive"
745,Spread of omicron variant in China sparks fear of major wave
746,Russian Navy announces shootings west of NATO's Arctic exercise
747,Putin allows Russian airlines to fly $10 billion worth of foreign-owned planes domestically
748,Russia's state TV hit by stream of resignations
749,Marina Ovsyannikova: Russian journalist fined and released after TV protest
750,Poland seeks humanitarian help to look after Ukrainian refugees
751,Talk of ‘compromise’ as Russia-Ukraine peace talks set to resume | Russia-Ukraine war News
752,Coronavirus: High death rates in Hong Kong show downside of zero-COVID strategy and poor vaccine targeting
753,Russian TV employee who staged on-air protest says she was interrogated for more than 14 hours
