,headlines
0,"Mass graves dug in the besieged Ukrainian city of Mariupol, as locals bury their dead"
1,British aircraft carrier leading massive fleet off Norway
2,Spain detains $600 million yacht linked to Russian oligarch: Reuters
3,Photo shows officials taking down the Russian flag after Putin gets the boot from Council of Europe
4,Marina Ovsyannikova: Russian journalist tells of 14-hour interrogation
5,China wary of being impacted by Russia sanctions: Foreign Minister
6,Israel is setting up a $6.4M field hospital in western Ukraine
7,Nigerian volunteer: 'Fighting in Ukraine is better than living here'
8,Tibetans seek justice after 63 years of uprising against Chinese rule
9,"Portugal backs EU sanctions against Russian oligarchs, even if those sanctioned are Portuguese citizens"
10,Holes the size of city blocks are forming in the Arctic seafloor
11,Russia issues sanctions against Biden and a long list of US officials and political figures
12,"The West should end its 'addiction' to Russian energy to stop Vladimir Putin's 'blackmail', Boris Johnson says"
13,Nigeria: Inflation rate rises to 15.70% as fuel scarcity impacts prices
14,"MEPs Call on EU Heads: Freeze EU Accession Negotiations for Serbia Now, Until It Distances Itself From Russia"
15,Russia's former chief prosecutor says oligarch Roman Abramovich amassed his fortune through a 'fraudulent scheme'
16,UN makes March 15 International Day to Combat Islamophobia
17,The Ministry of Foreign Affairs on Tuesday (March 15) praised a Russian woman for her courage after she held up an anti-war sign on live Russian TV. MOFA head: 'It takes courage to be the voice of conscience'.
18,"Braving conflict, many women join flow back into Ukraine"
19,"Not violation of sanctions but Russian oil deal could put India on wrong side of history, says US"
20,Saudi Arabia considers accepting yuan for oil sales
21,Russia and Ukraine looking for compromise in peace talks
22,'Why? Why? Why?' Ukraine's Mariupol descends into despair
23,"/r/WorldNews Live Thread: Russian Invasion of Ukraine Day 20, Part 1 (Thread #144)"
24,Guatemala Congress shelves same-sex marriage ban
25,Asteroid half the size of a giraffe strikes Earth off the coast of Iceland
26,Turkmenistan leader’s son wins presidential election
27,Rabbi who helped Abramovich get Portuguese citizenship under investigation
28,Russia bars entry to Biden and Canada’s Trudeau
29,Philippines summons Chinese envoy to protest naval intrusion
30,"Activists are reaching Russians behind Putin’s propaganda wall: Tinder, other apps give activists a way to share what's really happening in Ukraine"
31,'I'm on the frontline in Mariupol': the Chinese reporter embedded within Russian troops.
32,Pakistan rejects Indian statement on accidental missile launch
33,"Israel announces publicly for the first time it will comply with the international sanctions against Russia - Israel will not be route to bypass sanctions imposed on Russia, says foreign minister"
34,North Korea appears to have failed in projectile launch: S. Korea
35,China Locks Down More Than 45 Million People as Covid Returns
36,Dublin Port Workers Refusing to Unload Ship With Russian Diesel
37,Ukraine: EU agrees fourth package of restrictive measures against Russia
38,European leaders return safely after Kyiv visit amid attacks
39,Biden to travel to Brussels for NATO summit on Ukraine next week
40,Putin changes law on leased jets to keep them flying
41,Intel to Invest at Least $19 Billion for New Chips Plant in Germany
42,Pakistan presses ahead with Russian-built gas pipeline
43,Ukrainians who have evacuated to Japan following Russian invasion will be allowed to switch to a visa that permits them to work in Japan for one year. Justice Minister Furukawa said government will allow extension of the visa until situation in Ukraine improves.
44,"Poland suggests peace-keeping mission, not intervention, says official"
45,Leaders of 3 EU countries take train to Kyiv in show of support for Ukraine
46,Putin signs law allowing seizure of foreign planes for domestic flights
47,Ukraine Strikes Back: Barrage Leaves Russian-Occupied Kherson Airbase In Flames
48,"North Korea latest missile test ends in failure, says South Korea officials"
49,Slovaks charge 2 with spying for Russia's military service
50,Pro-Fidesz “Peace March” Protests against War and in Support of PM Orbán
51,Turkmenistan strongman's son wins presidential vote
52,Russian ambassador to Israel seeks ‘urgent’ Knesset meeting ahead of Zelensky speech
53,"Saharan dust storm covers Spain, reaches France and Portugal"
54,Russian troops shoot Ukrainian semiconductor scientist in Vorzel
55,Russian prosecutors call for Alexei Navalny to serve 13 years in prison
56,"Russia Must Suspend Military Operations In Ukraine, Directs International Court of Justice"
57,"Peace talks more 'realistic', says Ukraine president; Biden to visit NATO"
58,Ukraine and Russia draw up neutrality plan to end war
59,"Ukrainian President Volodymyr Zelensky has presented state awards to almost 247 Ukrainian service members, 26 of them posthumously"
60,New Zealand PM Ardern announces border reopening earlier than previously signalled
61,Concrete slabs spotted at airfield in Pyongyang for potential ICBM launch
62,Ukraine says it has detained a suspected hacker who allegedly helped Russia send texts to Ukrainians urging them to surrender
63,Russia formally quits Council of Europe
64,U.S. and allies launch joint task force to tackle Russian oligarchs
65,'Can you imagine?' war-hit Ukrainian president paints dire picture for Canadians
66,"Washington to provide Egypt with F-15 jets, U.S. general says"
67,Russia bars entry to Biden and Canada's Trudeau
68,UK announces 350 new sanctions listings on Russia
69,Zelenskyy signs law banning Russian propaganda
70,Russia says parts of a Ukraine compromise deal are close after Kyiv agreed to discuss neutrality
71,"Nunavut, Nunavik MPs resist Zelenskyy's call to close Ukraine airspace"
72,Japan to revoke Russia's most-favoured nation trade status -sources
73,"""We are already home, We are defending our land, our kids, our families, so we are not planning to put down any arms until our victory.""Says Ukrainian President Zelenskyy , asks Russian troops to go home"
74,"Oil falls below $100 on Russia-Ukraine talks, demand concerns"
75,England Announces Date For Removing All Entry Restrictions For Foreign Tourists
76,Ukraine peace talks with Russia were 'pretty good' - President Volodymyr Zelensky's full speech in English
77,"Russia does not want to occupy Ukraine, says Putin"
78,"Long refugee-shy, Japan prepares to welcome Ukrainians"
79,"Poland Seeks NATO Force In Ukraine On ""Peacekeeping Mission"""
80,Hijab bans deepen Hindu-Muslim fault lines in Indian state
81,"Decisions of Israeli leadership aimed at limiting admission of Ukrainians surprising - Andriy Yermak, head of the President’s Office of Ukraine"
82,[World] - Kazakhstan president proposes reforms to limit his powers
83,"Zelensky mourns death of Brent Renaud, U.S. journalist killed in Ukraine in an open letter"
84,Ukraine tells IAEA Russia preventing it from answering Chernobyl questions
85,U.S. warns Russia of consequences of any possible Russian use of chemical weapons - White House
86,"Russia leaves Council of Europe, avoiding being kicked out"
87,Israeli forces kill two Palestinians in West Bank violence
88,Supreme Court Of Russia's Karelia Upholds Sentence Of Historian Dmitriyev
89,Putin calls his war in Ukraine ''a success'': everything is going as planned
90,"Can Russia pay its creditors, and what happens if not?"
91,"Orthodox Christian Unity Broken by 'Russian World' Heresy / Orthodox clergy, lay people and scholars condemn Moscow Patriarch Kirill."
92,Germany to buy up to 35 Lockheed F-35 fighter jets
93,Poland slams Russian attack near its border as 'highly provocative' and trying to threaten all of NATO
94,Three prime ministers risk train ride to meet Zelensky - BBC News
95,Iran blames Israel for destroying hundreds of Iranian drones - report
96,Russian occupiers kidnap 6 employees and volunteers from Bucha City Council
97,"Few other western economies are as dependent on Russian energy as Germany: 55% of the natural gas, 52% of the coal and 34% of mineral oil used in the country comes from Russia, for which it pays hundreds of millions of euros daily."
98,"Fearing conscription, anti-war Russians flock to Uzbekistan | News"
99,Apple supplier Foxconn in talks to build $9 billion factory in Saudi Arabia
100,"Leaders of NATO countries discuss plans to meet in Brussels next week, officials say"
101,Russia proposes solution to end Ukraine war
102,Israeli doctors arrive in Ukraine to build NIS 21 million (6.4M$) field hospital
103,Ukrainian hackers say HackerOne is blocking their bug bounty payouts – TechCrunch
104,NATO to immediately begin planning for more troops and missile defenses in Eastern Europe
105,Vietnam resolutely opposes and demands Taiwan to cancel illegal live-fire drill on Spratly Islands
106,Bojo presses MBS to condemn Putin.
107,Russia-Ukraine conflict: ICJ to rule Wednesday on genocide claims
108,Suicides by women up in Japan for second year
109,FIFA hosts Amnesty International to discuss migrant workers before Qatar 2022
110,Russia to quit Council of Europe as it prepares to suspend Moscow
111,"Hamas, Islamic Jihad call to step up attacks in West Bank, Jerusalem"
112,Irish universities suspend student exchanges in solidarity with Ukraine - Independent.ie
113,"Czech, Polish, Slovenian PMs head to Kyiv to show Ukraine support"
114,"/r/WorldNews Live Thread: Russian Invasion of Ukraine Day 20, Part 2 (Thread #145)"
115,Zelenskiy says Russia’s position in negotiations is becoming ‘more realistic’ as fears deepen for Mariupol
116,"Vladimir Putin trying to justify invasion by holding 'faux elections', Foreign Office minister warns"
117,‘Bodies in the street’: The harrowing escape from Mariupol
118,"France ready to discuss 'autonomy' for Corsica, minister says"
119,Marina Ovsyannikova: Russian journalist fined after live broadcast protest | Russia
120,"Iran to free British-Iranian woman detained for years, U.K. lawmaker says"
121,Britain warns Putin of ‘war with Nato’ if Russia steps a ‘single toecap’ on its territory
122,How will Russia’s invasion of Ukraine affect global food access? | OEC
123,Taiwan military purchases Field Information Communications System from US
124,Zelenskyy directly challenges Biden during defiant address to Congress: 'I wish you to be the leader of the world'
125,Russian oligarch Abramovich spotted in Israeli airport
126,Top prosecutor says Russian oligarchs have no ‘escape hatch’ around sanctions
127,"NATO vows more help for Ukraine, begins planning to adapt to 'new reality'"
128,"Russia blocks BBC website, says it's only beginning of its response"
129,"JR East: Bullet train derailed, no injuries | NHK WORLD-JAPAN News"
130,Azerbaijan and Armenia organize negotiations for a peace treaty.
131,"Conflict and Complicity: 11,000 Civilian Casualties Caused by Saudi Coalition’s Use of Explosive Weapons in Yemen Since 2015 – Byline Times"
132,Russia says it received US guarantees on Iran nuclear deal
133,"Poland's Kaczynski, visiting Kyiv, calls for international peacekeeping mission to be sent to Ukraine"
134,Witness: Army attacks in eastern Myanmar worst in decades
135,"""If you surrender to our forces, we will treat you the way people are supposed to be treated — as people, decently.” Ukrainian president Zelensky calls on Russian troops to surrender"
136,Sentenced for a selfie: Middle East police target LGBTQ+ phones
137,Another Evergreen cargo ship runs aground nearly one year after Suez Canal obstruction
138,"Beijing denies Russia requested military equipment for Ukraine invasion as U.S., China meet"
139,Portugal changes law that allowed Russian oligarch Abramovich to obtain citizenship
140,Video of armed men burning man alive in western Ethiopia sparks outrage | Ethiopia | The Guardian
141,Ukraine and Moldova join the Continental Europe electricity transmission system
142,Shackleton’s ‘Endurance’ Shipwreck Is Teeming With Bizarre Ocean Life
143,"Turkish foreign minister to visit Russia, Ukraine for peace talks, Erdogan says"
144,Abramovich: Jet linked to oligarch lands in Moscow
145,Israel decimated Iranian drone fleet in February airstrike inside Iran
146,"Kyiv's mayor on potential for chemical weapon attack: ""Russia doesn't have rules"""
147,"Russian Debt Payments Are Due, and Uncertain: Citing sanctions, the Russian government warned it might pay foreign debt obligations in rubles. Credit rating agencies say a default is imminent"
148,"The United Nations warns acute cases of hunger in Yemen have reached an unprecedented level, with over 160,000 people likely to experience famine over the second half of this year."
149,"Spain has seized Russian oligarch’s $140m superyacht in Barcelona, PM says"
150,Nazanin Zaghari-Ratcliffe released after 6 years' detention in Iran
151,Kremlin Slams Sanctions on Russian Oligarchs As 'State Banditry'
152,"Airstrike victims were Ukrainian, officials say, rejecting Russia’s claim ‘foreign mercenaries’ died."
153,Russian forces have already killed at last 103 Ukrainian children
154,Russia says it has received written guarantees from Washington that Western sanctions on Russia will not affect cooperation with Iran
155,"Coalition to allow some projects, including mining, to bypass federal environmental approvals | Australian politics"
156,Ukrainian researchers pressure journals to boycott Russian authors
157,Anonymous hacks Russian firm running Ukrainian nuclear plant - Jerusalem Post
158,Ukraine rejects Russian neutrality idea as US steps up aid
159,Significant progress in Ukraine-Russia peace talks as 15-point plan to end war drawn up
160,"Germany warns against using Kaspersky software, citing ‘considerable’ cyber risk after Russia’s invasion"
161,"Over 170,000 special visas granted to Ukrainians in the Czech Republic"
162,"In Putin's vision for the world, a medieval narrative resurfaces"
163,France fails to win over doubters on how to implement global minimum corporate tax rate
164,Russia says it will not strand American astronaut in space despite media reports
165,"‘We had no choice’: over 8,000 Russians seek US refuge in six-month period | US-Mexico border"
166,"Hong Kong doubles down on 'Zero COVID' policy, as death rate soars to world’s highest"
167,"Ukraine war: Kyiv terrain will slow Russian troops, say Ukraine generals"
168,"India: Court upholds controversial hijab ban in Karnataka. The high court in Karnataka has upheld a ban on hijab-wearing in schools and colleges. The ruling could have major repercussions for the rest of the country, with India having a large Muslim minority."
169,Ukraine war: Singapore urges China to use ‘enormous influence’ on Russia to end conflict
170,Ukraine war: Roman Abramovich 'back in Moscow' after being 'spotted at Israeli airport' as EU 'agrees to impose sanctions' on Chelsea owner
171,Germany's greenhouse gas emissions rose in 2021 - environment agency | Reuters
172,Zelenskyy urges Ukraine no-fly zone in Canada parliament address
173,"Five men charged in the September 11, 2001 attacks, including alleged ""mastermind"" Khalid Sheikh Mohammed, are in plea negotiations to resolve the longstanding capital case, defense attorneys confirmed Tuesday"
174,Court rules Australian minister has no climate duty of care
175,A Study of Prehistoric Painting Has Come to a Startling Conclusion: Many Ancient Artists Were Tiny Children
176,Trashed New Zealand Parliament grounds reopen to the public after anti-mandate occupation's violent end.
177,Ukraine: Putin will search for a way to save face (BBC Foreign Affairs Editor)
178,Ukraine war: Zelenskyy issues 'life or death' surrender ultimatum to Russian soldiers - but is upbeat on progress of peace talks
179,Zelenskyy invited the Americans to create a new alliance
180,"Russia's war in Ukraine may 'fundamentally alter' global economic, political order - IMF"
181,Complete Anarchy’ as Russian Forces Disable Air Raid Warnings in Town Housing Nuclear Plant
182,Moscow accuses west of forcing ‘artificial’ default as dollar payments fall due on Wednesday
183,Russians to give American astronaut ride to Earth in spite of tensions
184,World's first CO2 emissions tariff to be introduced in the EU by 2026
185,"Pre-dawn explosions, residential apartment blocks on fire in Kyiv"
186,"With China trying to bail out Russia, challenges and opportunities for India"
187,Ukrainian Museum Director Arrested in Attack on Culture
188,Leaders of 3 EU nations head to Kyiv as attacks intensify
189,Seoul: North Korean missile exploded in air in failed launch
190,Russia threatens to nationalize Microsoft and other western companies
191,"Russia could use Kaspersky antivirus software in cyberattacks, German agency warns"
192,Nazanin Zaghari-Ratcliffe’s six years of bewilderment and injustice
193,Seventh journalist killed this year in Mexico as scrutiny mounts
194,Russia says Ukraine talks progressing as onslaught continues
195,A worker objected to Google's Israel military contract. Google told her to move to Brazil
196,"Polish, Czech and Slovenian prime ministers travel to Kyiv"
197,Compromise reached on COVID-19 vaccine intellectual property rights waiver
198,Biden expected to announce another $1 billion in military aid to Ukraine: more anti-armor and anti-air systems
199,They are Shelling Orphanages and Shooting Civilians: Bellator champion Yaroslav Amosov gives a harrowing update from Ukraine
200,"More than 3 million people have fled Ukraine, migration organization says"
201,Belarusian journalists handed jail terms in media crackdown
202,Ukrainians accuse Russians of holding hostages in Mariupol hospital
203,CIA black site detainee served as training prop to teach interrogators torture techniques | Torture
204,Israeli government websites crash after ‘massive’ cyberattack.
205,"Ukraine hopes to open 9 humanitarian corridors, get aid to besieged Mariupol"
206,Ukraine war: Lawyers search for journalist who protested on Russian TV
207,Black schoolgirl strip searched by police while on her period- Just one of the many things being hidden while the world looks at Ukraine.
208,Chinese Tech Stocks Soar After State Council Pledges Support
209,Russia seeks UN humanitarian resolution not mentioning war
210,Brittney Griner: How can a US basketball star just vanish?
211,Moscow to retaliate against Montenegro over expulsion of Russian diplomat
212,"Russian rockets destroy runway of Dnipro regional airport, says governor"
213,Singapore: China should use enormous influence on Russia
214,"Chevron set to trade Venezuelan oil if U.S. relaxes sanctions, sources say"
215,Germany warns against Russian anti-virus use
216,Marina Ovsyannikova's TV Protest Receives Support on Russian Social Media
217,Ukraine war: UK announces sanctions against 350 more Russian individuals and entities
218,"Russian journalist interrogated, fined after protesting war during State-TV broadcast"
219,"Yemen: UN says dozens of children killed or maimed in two months. More than 10,000 children have been killed or wounded since the Yemen civil war erupted, with the number feared to be higher"
220,"Putin has brought threat of nuclear conflict ‘back within the realm of possibility,’ U.N. chief says"
221,7.3 Earthquake off coast of Japen
222,Ukraine's wartime rail chief has to be faster than the Russians tracking him
223,Baltic leaders ask NATO for permanent troops amid fears Russia will invade
224,"ICC’s investigators are in Ukraine, collecting evidence against Russia - Zelenskyy"
225,Kyiv curfew: Kyiv to impose curfew for 'difficult and dangerous' 36 hours
226,Ukraine War: Russia Ally Belarus Says Resisting Attempts To Drag It Into Ukraine Conflict
227,"Meta ban sees Russians' demand for VPNs skyrocket by 2,000%"
228,"Zelensky sees room for compromise as 20,000 escape Mariupol"
229,Humanitarian convoy didn't reach Mariupol: aggressors don't allow buses for evacuation to come
230,"New Zealand to reopen border to Australians in April, others in May"
231,Covid in Scotland: Mask rules will stay in force until April
232,UK says new laws will enable faster crackdown on Russian 'dirty money' | Reuters
233,Two anarchists arrested for making bombs in Genoa
234,Ukraine's Zelenskiy submits bill extending martial law until late April
235,Council of Europe expels Russia over Ukraine invasion
236,First NATO Country Calls for No-fly Zone in Ukraine
237,President Zelenskyy signs off on laws punishing collaboration with Russia
238,[World] - Several Palestinians including teen killed by Israeli forces
239,"Russia is close to defaulting on its debt for the first time in decades, with two payments totaling $117 million due on Wednesday"
240,Elon Musk's Starlink was Ukraine's most downloaded app last Sunday
241,Polish PM says he has arrived in Kyiv
242,Another Batch of SpaceX Starlink Terminals Arrive in Ukraine
243,"Putin says Russia will achieve goals in Ukraine, won't bow to West"
244,Anti-war protester interrupts main Russian news show
245,Zelensky claims Russia has already suffered more casualties in Ukraine than during Chechen wars
246,Brazil Congress fast-tracks ‘death package’ bill to mine on Indigenous lands
247,"ICC Prosecutor Khan visits Ukraine, holds virtual meeting with President Zelenskiy"
248,Russians come and start like terrorists: Ukrainian UFC fighter Maryna Moroz
249,Biden may go to Europe to meet allies over Russia-Ukraine
250,UK bans luxury goods exports to Russia and hikes import tariffs on products - including vodka
251,"Putin's negotiators 'becoming softer' in peace talks, Zelenskyy advisor reveals"
252,Nato masses 30k troops & 50 warships for huge war games near Russia's border
253,Foreign fighters in Ukraine await weapons in chaos of war
254,Intel to invest €33bn in EU semiconductor manufacturing network
255,AP News: 'Why? Why? Why?' Ukraine's Mariupol descends into despair
256,New Zealand announces border opening dates for visitors and tourists
257,China says G20 is not an appropriate forum to discuss Ukraine issue
258,Kyiv to impose 35-hour curfew amid fresh Russian attacks | News | Al Jazeera
259,Russia loses its first GRU military intelligence spy in Ukraine war
260,Odesa's Maze-Like Catacombs Could Be Bad News For Russian Invaders
261,"US holds Chinese goods, cites possible North Korean labor"
262,India court upholds Karnataka state’s ban on hijab in class
263,China says it does not want to be impacted by Russia sanctions as pressure grows on Beijing to withdraw support from Moscow
264,Ukraine Needs More Military Aid from NATO—And Fast
265,"Russia imposes sanctions against Justin Trudeau, Canadian lawmakers"
266,Zelenskyy approaches Japan over possible online speech to Diet
267,Third of Americans would risk nuclear war with Russia over Ukraine: poll
268,New value of pi calculated by Swiss university at over 62 trillion digits
269,"Three EU country leaders (Poland, Czechia, Slovenia) take train to Kyiv in show of support for Ukraine"
270,Zelensky to Canadians and the diaspora: We want to live
271,"Half of low-paid workers in UK given less than week’s notice of shifts, according to study highlighting “insecurity premium” for employees paid close to minimum wage. Campaigners say workers face ‘insecurity premium’ due to added costs of childcare and travel when shifts are changed at short notice"
272,"EU to tighten sanctions on Russian oil companies, but stops short of import ban - source | Reuters"
273,German citizens told to uninstall Kaspersky antivirus
274,United Nation says woman who protested on Russian TV should not face reprisals
275,Yuan deposits replace dollar and euro in Russian banks
276,"Once a powerful symbol of optimism, McDonald’s departure sends Russia into isolation"
277,Switzerland step up economic sanctions against Belarus
278,"Armenia ready to establish diplomatic ties with Turkey, RIA says"
279,International Court of Justice orders Russia to suspend Ukraine invasion
280,Hacker breaches key Russian ministry in blink of an eye
281,Russia accuses Bangladesh media of 'bias' on Ukraine war coverage
282,"The Justice Department will accuse Chinese government agents of waging campaigns to intimidate critics living in the United States, among them the dad of an Olympic figure skater, in new criminal charges expected to be formally announced Wednesday"
283,U.N. seeks $4.3 bln for Yemen to avert mass starvation as funding dwindles
284,China: Businesses shut as officials widen Covid lockdowns
285,CIA black site detainee served as training prop to teach interrogators torture techniques
286,"Spain detains yacht linked to Russian oligarch Mikheyev, police source says"
287,Pressure on Putin must be increased to the maximum - German Finance Minister
288,Zelenskyy begs Canada to help 'close the sky' in address to House of Commons
289,"As China’s infections rise, economic prospects take another hit and stock sell-off worsens"
290,EU hits Russia with more sanctions: From trade to truffles
291,Ukraine becomes part of the EU energy system
292,Asteroid half the size of a giraffe strikes Earth
293,UK PM Johnson defends Saudi visit after mass execution
294,'Innocent passage': Beijing defends Chinese navy ship's intrusion into Sulu Sea
295,Japan to grant entry to war-fleeing Ukrainians without guarantor - The Mainichi
296,"UK: 25,000 sign up to host a refugee scheme in first 3 hours"
297,Abramovich jet lands in Moscow after brief stop in Istanbul
298,Finland prepares for hybrid attacks at border
299,India's top refiner IOC buys 3 mln bbls Russian Urals crude via tender -sources
300,Argentina discusses 'resettlement opportunities' for Ukrainian refugees with UN body
